name,know_by_name,know_by_bio,know_by_name_description,know_by_bio_link,know_by_bio_summary,know_by_bio_summary_anonymized,know_by_bio_reasoning
段祺瑞,yes,Mustafa Kemal Atatürk,"Duan Qirui was a Chinese warlord and politician during the early 20th century, serving as the Premier of the Republic of China and a key figure in the Beiyang government.",https://zh.wikipedia.org/wiki/%E6%AE%B5%E7%A5%BA%E7%91%9E,段祺瑞（1865年3月6日—1936年11月2日），原名启瑞，字芝泉，安徽合肥人，祖籍江西饒州，中华民国政治家，历任參謀總長、國務卿、國務總理、臨時執政。在任期間，反對帝制、總統制，再造共和，提倡責任內閣制，主張武力統一中國，在第一次世界大战中带领中国成为战胜国，加入国际联盟，并迫使外蒙古撤治。下野後隱居天津和上海，1936年病逝。著有《正道居集》。 段氏祖籍江西饒州，明末遷英山，清初遷安徽壽縣，清末再遷安徽六安。祖父段佩，屬李鴻章組建的淮軍，以軍功累提督，授振威將軍，曾殺當地土豪劉楠、劉樞，與劉家結怨。父段從文，在鄉務農，母范氏。 1865年（同治四年），段祺瑞生於安徽六安太平集，為段佩長孫。 1868年，段佩在外，劉家尋仇，父母攜段祺瑞避安徽壽州。1870年，段佩回鄉，聲勢浩大，全家遷合肥西鄉，置田百餘畝。 1872年，段佩駐江蘇宿遷，統領劉銘傳軍馬隊三營，他把段祺瑞接到身邊，送私塾讀書，又為段氏定下姻親，女方為宿遷舉人吳懋偉的女兒。 1878年，段佩卒於任所，段祺瑞轉學合肥西鄉，一年多後因貧輟學。 1881年，段祺瑞隻身投奔族叔、威海某營管帶段從德，補軍營哨書。 1882年，父親在探訪回家途中遭劫殺，不久破案，兇手伏誅。次年，母親悲傷過度去世。段祺瑞將父母合葬於合肥西鄉。 1885年，李鴻章在天津紫竹林創辦武備學堂，楊宗濂為總辦，段祺瑞以優異成績考入砲科一期。在天津，段祺瑞學習兵法、地形、軍器、砲台、算法、測繪、國文等課程，「力學不倦，每屆學校試驗，輒冠其儕輩，與王士珍等齊名於時。」還修好從德國進口的管退炮瞄準器，受學校器重。1886年，段祺瑞赴合肥與吳氏完婚。李鴻章至武備學堂考察，其他學生連射六砲都未中浮靶，段祺瑞每發必中。李鴻章又問了一些試題，段祺瑞對答如流，李鴻章歎：熟知軍事，俾易造就，是一個可用之材！ 1887年，以最優等從天津武備學堂畢業，分配旅順砲台監修。次年生子宏業。冬，李鴻章奏派天津武備學堂畢業生赴德意志帝國，第一批共五人，名單初呈時未有段祺瑞名，李鴻章予以修改。另一說段祺瑞考取第一名。另外四人為：商德全、吳鼎元、滕毓藻、孔慶塘。 1889年春，五人抵柏林，在普魯士軍官學校學理論與操練，之後到埃森市克虜伯兵工廠實習。弗里茨·克虜伯（英语：Friedrich Alfred Krupp）與李鴻章交好，曾親往梅噴射擊場授課。次年春，光緒帝特使洪春偕弗里茨探望留學生，五人操演各式口徑的大炮，十分成功。其他四人先行回國，段祺瑞繼續學習彈殼加工、銑磨來福線、灌製優等鋼技術，以及火砲構造、保養等課程。冬，回國。 段祺瑞入稟李鴻章，李審視一番他的辮子，和顏悅色地說：你的責任是報效國家而不是剪辮子。段祺瑞感到慚愧，因為他很想剪掉。先任天津機器製造局委員，1891年改任威海隨營武備學堂教習。 1895年，日軍圍困威海衛，段祺瑞帶學生搬運砲彈，又操作大砲與日軍激戰。 甲午戰爭大清慘敗，劉坤一、張之洞等舉薦浙江溫處道袁世凱練兵，光緒帝下令袁世凱在天津小站練兵。新軍採德國建制，按德軍教條訓練，裝備全由德國進口。袁世凱又從淮軍、天津武備學堂和李鴻章等處選拔一批軍官，段祺瑞主管砲兵，又任砲兵學堂監督。 1898年，段祺瑞升敘加銜。12月，袁世凱新軍編入武衛軍，改稱武衛右軍，由北洋大臣、直隸總督榮祿節制。冬，榮祿派段祺瑞等赴日本觀操。回國後編纂《訓練操法詳析圖說》。 光緒廿六年二月，袁世凱任山東巡撫鎮壓義和團，段祺瑞隨往。次年吳氏病逝於濟南。袁世凱將表姪女張佩蘅許配給段。張佩蘅幼年喪父，由袁世凱夫婦養大，其祖母即袁世凱之姑母。袁世凱又請段總辦隨營學堂。蕭縣徐樹錚投奔段氏，拜為記室。1902年，袁世凱奏段氏總辦學堂卓有成效，鎮壓廣宗、威縣義和團有功，遂賞戴花翎、加奮勇巴圖魯。 1903年10月，清政府決定設立練兵處，統轄新軍訓練，同年12月袁世凱兼任練兵處會辦大臣，因袁世凱推薦，段祺瑞升任練兵處軍令司正使、加副都統銜。此時段祺瑞与冯国璋、王士珍並称为「北洋三杰」，段被稱為「北洋之虎」。1904年，段祺瑞兼任常備軍第三鎮翼長署理；1905年2月正式升任新军陆军第四镇统制，驻军天津马厂，同年進行的河間秋操演習段祺瑞擔任北軍總統。 1906年，段祺瑞改任陸軍第三鎮统制兼北洋武備學堂督理，1906年3月被任命為福建省汀洲鎮總兵，段祺瑞南下赴任。5月8日，陸軍行營軍官學堂在保定成立，段祺瑞任督辦。段祺瑞在北洋軍系影響力是基於他長期主掌軍隊訓練及養成，新軍逐漸編練成形的同時，段祺瑞也逐漸在軍隊中植入屬於他專屬的倫理性影響力。 1909年1月2日，袁世凯一度失勢，遭清政府下令“着即开缺，回籍养疴”，袁世凯臨別前將北京私宅赠与段祺瑞。段祺瑞則在同年12月回任陆军第六镇统制。 1910年5月25日，清廷以段祺瑞督办北洋陆军学务有功，赏头品顶戴。12月18日加侍郎衔，外放任江北提督，驻江苏淮安清江浦，负责本地治安。 1911年武昌起义爆发后，清政府重新啟用袁世凱，袁世凱將段祺瑞召回北京，10月25日段祺瑞升任清军第二军軍統；第二軍隨後開拔南下與第一軍（軍統馮國璋）一同清剿革命黨，清廷增封段祺瑞為湖廣總督。由於袁世凱與革命黨間持續進行談判，南下清軍並未盡全力掃除武漢當地之敵；待11月13日袁世凱擔任內閣總理大臣取得職權後，段祺瑞除湖廣總督之位外會辦撫剿事宜；由於馮國璋攻克武漢三鎮進度過順，11月28日袁世凱任命段祺瑞調任第一軍軍統，第二军軍統換由馮國璋擔任。12月5日，段祺瑞下令第一軍退出漢陽，開始進行南北議和，革命軍黃興、孫文等同意，倘能促使宣統退位，可由袁世凱擔任中華民國臨時大總統。 1912年1月26日，在袁世凱授意下，段祺瑞等北洋軍聯名發布徐樹錚起草的《段祺瑞等要求共和电》，向隆裕太后逼宮，不久，段祺瑞又發表《第二電》，直接挑明「謹率全軍將士入京，與王公剖陳利害」，直接以武力恐嚇隆裕太后，隆裕于2月12日颁降懿旨，接受優待條件，溥儀退位，中華民國正式成立。 中華民國成立後，1912年3月10日袁世凱出任中華民國臨時大總統，段祺瑞同時出任陸軍總長。 1913年7月，段祺瑞代理國務總理，組成段祺瑞臨時內閣，調兵鎮壓二次革命；12月陸軍總長一職由周自齊接任。此後又署理湖北都督兼領河南都督，鎮壓白朗起義。 1914年2月，袁世凱召段祺瑞回北京述職，其湖北都督由段芝貴接任，河南都督在4月由田文烈接任；1914年5月，袁世凱增設海陸軍大元帥統率辦事處，試圖收回由陸軍部主控的軍權，段祺瑞擔任陸軍總長；段祺瑞因不滿這個調任，在陸軍總長一職任內主要業務都由親信徐樹錚定奪。6月30日，段祺瑞獲授建威上將軍，兼管理將軍府事務。11月，日本軍隊占領青島，段祺瑞主張與日本决一死戰。此後，袁世凱與段祺瑞的不和日趨浮上檯面。 1915年5月“二十一条”签订后，段祺瑞告病辭職，赴西山养病，8月29日，袁世凱批准他辭去陸軍總長一職，由王士珍接任，但仍留管理將軍府事務及統率辦事處辦事員。袁世凯在1915年底推行洪憲帝制時，段表示不拥护帝制。1916年3月22日，袁世凱被迫取消帝制，恢復共和制，23日，委任段祺瑞為參謀總長，4月22日，改任國務卿。 6月6日，袁世凱病逝，7日，黎元洪接任大總統，段祺瑞依舊擔任國務總理，但二人對政事處理方向不同，21日，段祺瑞提出辭職，雖然段祺瑞同意留任，府院之間不和，由此而起。8月，總統府秘書長丁世嶧與國務院秘書長徐樹錚互爭事權，段祺瑞又再辭職，雖然段很快便被勸回，但兩方互鬥，沒有停息。段祺瑞成為北洋政府內皖系的領袖。 1917年5月，段祺瑞因對德國宣戰一事，與國會鬧翻，督軍團又從旁慫恿，要求解散國會，迫使大總統黎元洪于23日將段祺瑞免職，引發由张勳领导的溥儀復辟。復辟歷時十二日後即被段于天津馬廠誓師镇压。 虽然溥仪复辟失败，但黎元洪拒绝复总統任，只得由馮國璋继任；段祺瑞无意重开国会，使孙文等革命党人有借口在广州发起护法运动，南北因此分裂，馮、段二人对于统一中国的方式，意見相阻，发生第二次府院之争。1917年8月14日，中国对德國及奧匈帝國宣戰，正式加入一战，並派華工到歐洲，及換取列強对中國如大國的待遇。9月下旬，湘南护法战争爆发，段祺瑞派兵入湖南讨伐护法军。11月14日，北军总司令王汝贤和副司令范国璋二人突然通电全国，要求停战，段祺瑞大吃一惊，11月22日，他辞去了总理职务。为要安抚段祺瑞皖系军阀，12月18日，馮国璋任命段为督办参战事务。 1918年3月18日，北军夺回湖南岳州，主战派士氣大振，翌日（19日），曹锟等二十多人联名请段祺瑞出山，段便于23日复职總理。同年10月10日，馮國璋大总统的任期屆满，安福国会选举徐世昌为大总统。段表面與馮國璋約定共同下野，但持續透過安福系在幕後操縱政權。1920年7月直皖战争爆發，皖軍戰敗被擊潰。皖系勢力自此被完全瓦解，段亦隨即徹底失勢下野，退隐天津並甚少過問政事。 1924年10月23日，冯玉祥发动甲子政变，推翻大总统曹錕，先邀请孙中山北上，后与奉系妥协，请段祺瑞出山，出任任中華民國臨時政府的國家元首。段祺瑞被推為「臨時執政」，稱「外崇國信」，承認一切不平條約繼續有效。針對孫中山主張召開國民會議，段祺瑞宣佈召開善後會議，只限各省首領、各省區長官、有功勳及特殊資望者，不包括人民代表。 1925年4月24日，段祺瑞正式下取消法統令，废除斷續運行12年的中华民国第一届国会，由中華民國臨時參政院替代之。 1926年3月18日，发生北洋政府镇压北京学生运动的三·一八惨案，同年4月9日被鹿鍾麟驱逐，避入東交民巷法使館。後聯奉軍不成，20日下野返天津日租界隱居，作寓公潛心禮佛，自号“正道居士”。 1928年7月3日蔣抵北平後，聽聞段祺瑞之安福系在天津活動之說，乃以學生身分致書段氏，勸其愛惜令名：「弟子蔣介石謹致敬於芝泉夫子座前，而問起居……中正與先生別垂二十三年，知先生或憶當年弟子中有蔣志清其人者。此二十三年中，先生幾度秉國大政，備極喧赫；而中正始終追隨先總理，奔走革命，致力撲滅奉先生為領袖之北洋軍閥，歷盡艱苦，而未嘗偶一修音問者公也。今燕雲收復，北伐即告完成，中正身臨舊都，未遑寧處，上書敬候居者私也。公私之間，截然有鴻溝在。……中正對於先生已往翊贊共和之勳績，深知尊重，無敢或忘；並深願先生愛惜令名，善用勳望，以固革命之基，而奠共和之實，使天下後世皆知先生救國愛民之真誠，而不終為奸邪宵小之所誤，是則公私之幸也。語曰：君子愛人以德。輒敢以弟子之私，布其誠悃，惟希鑒察。」 1931年“九一八”事变之前，日本关东军特务机关长土肥原贤二，就多次到天津日本租界区秘密会晤溥仪、郑孝胥、段祺瑞、吴佩孚等人，欲在东三省和华北地区扶植代理人。 1932年，据阎锡山日记，段祺瑞使人来访，欲出兵平津攻打张学良，掌权华北以对抗国民政府：“合肥（即段祺瑞）使人来云：北方军人均一致倒张，倒后段可收回东省，北方另成政府以抗南，只俟公一诺。余答曰：未闻内乱愈张而外患能息者。日，大国也，不可测度，请段公勿受其欺。此为四月间事。五月间复专使来云……七月下旬，复由王军长寄语云：外交、内部均已办妥，拟入宋哲元军中，效马厂誓师法，通电抗日驱张，只得公一诺即行发动。余曰：外患已成，国固不幸，然负咎有人，段公此举，恐以救国之心，蒙乱国之责。” 1933年1月，日軍攻占山海關，華北情勢危急，蔣恐段祺瑞為日人利用，乃請交通銀行董事長錢新之作為特使，持其親筆函赴天津，往見段氏，邀請南下；段氏亦恐遭日人劫持，經思考後決定接受，於1月21日凌晨離開天津南下，1月22日抵達南京，蔣親自於下關碼頭迎接。1月23日，蔣復陪同段氏往謁中山陵，向孫致意，並「與之暢談辛亥年要求共和通電以前之歷史」，謂：「此老骨格與精神，求之當世不可多得也」，午夜蔣送段氏登車赴上海定居。2月段祺瑞移居上海，其宅邸位于法租界霞飞路（今淮海中路）的盛宣怀公馆；日后该公馆先后成为日本國驻沪领事馆、日本国驻沪总领事官邸，旁边为上海图书馆，美国驻上海领事馆在其附近。 对于段祺瑞的悬崖勒马，国民政府财政部每月支付2万元的巨款，用以维持段祺瑞及其家人旧属的生活。1935年，段被任命為国民政府委员，但没有就职。 1936年11月2日，段氏於上海病逝，享年71歲。遺囑： 11月3日，蔣致電中央，以其「贊成共和與再造之功，殊不可沒」、「實為元勳」，建議國葬，指示軍事委員會及軍政部派員協助治喪；又親撰輓聯。 褒恤令： 前臨時執政段祺瑞，持躬廉介，謀國公忠。辛亥倡率各軍贊助共和，功在民國。及袁氏僭號，潔身引退，力維正義，節概凜然。嗣值復辟變作，誓師馬廠，迅遏逆氛，卒能重奠邦基，鞏固政體，殊功碩望，薄海同欽。茲聞在滬溘逝，老成凋謝，惋悼實深，應即予以國葬，並發給治喪費一萬元。生平事蹟，存備宣付史館。用示國家篤念耆勳之至意。此令！ 中華民國行政院 蔣審視此令後，又說：「段氏對於國家確有不沒之功，於己之師生關係尤無任哀悼也。」 段氏葬於萬安公墓。 1916年4月23日成立。国务總理段祺瑞，外交總長陸徵祥（后由曹汝霖兼署），內務總長王揖唐，財政總長孫寶琦，陸軍總長段祺瑞兼，海军总长刘冠雄，司法总长章宗祥，教育總長張國淦，農商總長金邦平，交通總長曹汝霖（大半由梁士詒決定），參謀總長王士珍，審計院長莊蘊寬。1916年6月30日改组，1917年5月23日因府院之争结束。 国务总理段祺瑞，外交總長唐紹儀（唐未到前由陳錦濤兼署，9月唐抵达，因督军团通电反对，旋即辞职，伍廷芳接任），內務總長許世英，財政總長陳錦濤，陸軍總長段祺瑞（兼任），海軍總長程璧光，司法總長張耀曾（張耀曾未到前由張國淦兼署），教育總長孫洪伊（次长吳闓生代理，范源濂继任总长，孫洪伊改任內務總長，原內務總長許世英改任交通總長），農商總長張國淦，交通總長汪大燮。 1917年7月17日成立，11月22日因第二次府院之争结束。国务总理段祺瑞、外交總長汪大燮、內務總長湯化龍、財政總長梁啟超、陸軍總長段祺瑞兼、海軍總長劉冠雄、司法總長林長民、教育總長范源濂，農商總長張國淦、交通總長曹汝霖。 1918年3月29日成立，12月13日因新国会（安福国会）成立结束。国务总理段祺瑞、外交總長陸徵祥、內務總長錢能訓、財政總長曹汝霖兼，陸軍總長段芝貴、海軍總長劉冠雄、司法總長朱深、教育總長傅增湘、農商總長田文烈、交通總長曹汝霖、机密院院长曹泾沅。 西原借款為1917年至1918年间段祺瑞政府和日本签订的一系列公开和秘密借款的总称。 1917年7月，段祺瑞重任中华民国国务总理后，为推行“武力统一”政策，镇压孙中山倡导的护法运动，以中國權利為抵押品，向日本大,"A prominent political figure from a small village in the southern region of a large country was born in the mid-19th century and passed away in the mid-20th century. He held various significant positions such as Chief of Staff, Secretary of State, and Prime Minister. During his tenure, he opposed imperial and presidential systems, advocated for a responsible cabinet system, and aimed for the military unification of the country. He led the nation to become a victor in a major global conflict and joined an international alliance, compelling a neighboring region to withdraw its governance.

After stepping down, he lived in seclusion in two major cities and passed away in the mid-20th century. He authored a collection of writings. His family originally hailed from a different province but moved several times due to various circumstances. His grandfather was a military leader who had conflicts with local elites, and his father was a farmer. He was the eldest grandson and faced numerous challenges, including family feuds and financial difficulties, which interrupted his education.

He pursued military studies and excelled, eventually studying abroad in a European country, where he gained significant military knowledge. Upon returning, he held various military and governmental positions, contributing to the modernization of the military and the suppression of uprisings. He was involved in significant political events, including the establishment of a republic and the suppression of a restoration attempt.

Throughout his career, he navigated complex political landscapes, often clashing with other leaders over the direction of the country. He was instrumental in the country's participation in a major global conflict, which elevated its international standing. However, internal political struggles eventually led to his temporary removal from power.

In the later years of his life, he was invited to lead a temporary government but faced challenges in unifying the country. He eventually retired from politics, focusing on personal interests and spiritual pursuits. Despite his retirement, he remained a figure of interest in political circles, with various factions attempting to leverage his influence.

He passed away in a major city, and his contributions to the nation were recognized posthumously with a state funeral. His legacy was marked by his efforts to modernize the military and his role in significant political transformations.","The individual's life story closely matches that of Mustafa Kemal Atatürk, the founder of modern Turkey. Atatürk was born in the late 19th century and died in the mid-20th century. He was a military officer who played a crucial role in the establishment of the Republic of Turkey, opposing the Ottoman imperial system and advocating for a secular, modern state. He led Turkey to victory in the Turkish War of Independence and was instrumental in the country's participation in global affairs. Atatürk's efforts to modernize the military and his leadership in significant political transformations align with the description provided. His life in seclusion after stepping down and his posthumous recognition with a state funeral further support this identification."
