name,know_by_name,know_by_bio,know_by_name_description,know_by_bio_link,know_by_bio_summary,know_by_bio_summary_anonymized,know_by_bio_reasoning
朱元璋,yes,Emperor Taizu of Ming,"朱元璋, also known as Zhu Yuanzhang, was the founding emperor of the Ming Dynasty in China, reigning from 1368 to 1398.",https://zh.wikipedia.org/wiki/%E6%9C%B1%E5%85%83%E7%92%8B,明太祖朱元璋（1328年10月21日—1398年6月24日），原名朱重八，曾改名朱興宗，字国瑞，濠州钟离县（今安徽省凤阳县）人，中国明朝開國皇帝，于公元1368年建立明朝，在位三十一年，年号“洪武”，廟號「太祖」，谥號「开天行道肇纪立极大圣至神仁文义武俊德成功高皇帝」，統稱「太祖高皇帝」。 幼时贫穷，曾为地主放牛。後因災變，曾一度剃髮出家，四处流浪，化緣為生。25岁（1352年）时，参加郭子兴领导的红巾军反抗元朝政权，並受郭子興取名元璋。先後击败了陈友谅、张士诚等其他諸侯軍閥，统一南方。後北伐推翻了元朝统治，建立了新的大一統皇朝政權，国号“大明”。 建国之后，朱元璋下令农民归耕，奖励垦荒；大興移民屯田和军屯；组织各地农民兴修水利；大力提倡种植桑、麻、棉等经济作物和果木作物；下令解放奴婢；减免賦稅。派人到全国各地丈量土地，清查户口等等。经过洪武时期的努力，社会生产逐渐恢复和发展，史称「洪武之治」。同时立《大明律》，用严刑峻法管理百姓与官僚，禁止百姓未经许可自由迁徙，并极为严厉地惩治官吏的贪污腐败。朱元璋还设立了锦衣卫等特务机构，整肅他認為威脅其朝廷之顯貴勢力，在胡、藍等案中大殺開國功臣，並废中书省，由皇帝直領各部，进一步加强了君主專制。 朱元璋生活儉樸、工作勤奮，在今南京的皇宮內，沒有設立“御花園”，只有“御菜園”，其中種滿蔬菜，使得皇宮自給自足。大封宗籓，令世世皆食歲祿，不授職任事。洪武元年令：「凡孝子順孫、義夫節婦、志行卓異者，有司正官舉名，監察御史、按察司體覆，轉達上司，旌表門閭。又令：民間寡婦，三十以前，夫亡守制，五十以後，不改節者，旌表門閭（貞節牌坊），除免本家差役。」洪武二十六年令：「凡婦人因夫、子得封者，不許再嫁。如不遵守，將所授誥赦追奪，斷罪離異。其有追奪為事官誥赦，具本奏繳內府，會同吏科給事中、中書舍人，於勘合低簿內，附寫為事緣由，眼同燒毀。」使明朝婦女守寡盛行。此外，亦創立明朝入宮婦女的生殉制度。1398年，朱元璋驾崩于南京，後传位于嫡长孙朱允炆，即明惠帝。 元文宗天曆元年九月十八日（1328年10月29日）未時，朱元璋出生於濠州钟离县东乡（今安徽省凤阳县小溪河镇燃灯寺村），排行第三。朱元璋先世家沛（今江苏沛县），後徙句容（今江苏省句容市）达百年之久。祖辈生活在古泗州（今江苏省盱眙县）。父親朱五四（後改為世珍），母親陳氏為泗州盱眙人、或濠州钟离县（今安徽省凤阳县）人。朱元璋出身贫农家庭，出生地之争由来已久，有明光说（也就是盱眙说、嘉山说）、凤阳说（也就是钟离说）、句容说、五河说、沛县说、宿州说等。后四说基本上没有证据支持，经不住推敲，明显不能成立。争议主要出现在明光和凤阳之间（均位於今安徽省東部）。 朱元璋幼時甚貧困，並無法讀書，曾為地主放牛。牧童伙伴多人都奉朱为领袖，且日后成朱起义将领多人，至正四年四月（1344年）淮北大旱，引發饑荒，初六朱元璋父親去世，初九兄長去世，廿二日母親去世，朱元璋與仲兄埋葬家人後於秋九月入皇覺寺當行童。入寺五十日，因荒年寺租難收，寺主封倉遣散眾僧，朱元璋只得離鄉為遊方僧雲遊淮西潁州。 元至正八年（1348年），朱元璋游歷淮西、汝潁、泗等州完畢，返回皇覺寺并逐渐讀書识字。至正十二年（1352年）二月辛丑，身在皇覺寺多年的朱元璋受好友湯和來信勸說，到濠州投靠郭子興，參加紅巾軍。由於指揮有方，不久便成為郭子興身旁一名親兵并赐名元璋字国瑞，並娶郭子興養女马氏（即後來的孝慈高皇后马氏）。後來朱元璋見郭子興與其他濠州紅巾軍領袖如孫德崖、趙均用不和，屢有衝突，朱元璋不願涉及濠州內鬥，故主動要求返家鄉招募新兵，徐達、湯和等朱元璋兒時好友獲准隨行，不久朱元璋的部隊已有結集了數千人。次年，朱元璋部隊攻下滁州，成為他首個據點，同時也在攻佔滁州期間，李善長加入朱元璋部隊，成為他一個重要幕僚。此時，濠州的郭子興被孫德崖及趙均用迫走，前來滁州投靠朱元璋，由於朱元璋名義上仍是郭子興部下，朱元璋乃將滁州兵權交予郭子興。 至正十四年（1354年），張士誠據高郵，自稱“誠王”；十五年，元朝丞相脫脫率軍進攻高郵，分兵攻六合，六合乃滁州屏障，故朱元璋領兵援六合，幸好脫脫被誣陷而被迫交出兵權，元軍不戰自潰，滁州也轉危為安。朱元璋見滁州地小，建議進攻長江北岸的和州。朱元璋攻下和州不久，郭子興病故，郭子興次子郭天敘被立為都元帥，朱元璋與郭子興妻弟張天祐為副元帥，遥奉韩林儿的大宋龙凤政权。同年夏，常遇春、廖永安、俞通海歸附朱元璋，使得其軍著手渡江攻入采石、太平路，並計劃攻取集庆路（今南京市）。此時，元軍降將陳野先願協助紅巾軍攻集慶，郭天敘與張天祐感軍功不及朱元璋，故決定在陳野先引領下，親自領軍攻打集慶。結果紅巾軍攻集慶時陳野先叛變，郭、張二人被殺，陳野先也死於亂軍中。郭天敘與張天祐死後，朱元璋成為都元帥，盡領郭子興舊部。至正十六年（1356年），朱元璋領軍再攻集慶，一舉攻陷，改名應天府，作為根據地。至此，朱元璋以應天府為中心，與元朝軍隊、張士誠、徐壽輝等部形成犬牙交錯之勢。 朱元璋攻佔應天後，開始攻佔應天周邊地區以鞏固防務。至正十六年，遣徐達攻佔鎮江、鄧愈克廣德，次年，遣耿炳文克長興，徐達克常州，而朱元璋親自率眾攻取寧國。隨後趙繼祖克江陰、徐達克常熟。胡大海克徽州、常遇春克池州，繆大亨克揚州。至正十八年，朱元璋親取婺州。明年，朱元璋陸續攻佔浙東餘下各地，常遇春克衢州、胡大海克處州，至此朱元璋部控制江左、浙右各地，向西與陳友諒部相鄰。朱元璋攻下浙東後，小明王升朱元璋為儀同三司江南等處行中書省左丞相，同時朱元璋也得浙東名士如朱升、劉基相助，朱元璋採取朱升「高築牆、廣積糧、緩稱王」的建議，採取穩健的進攻措施；並且遵照劉基「先漢(陳友諒)後周(張士誠)」之策略，着手對江南各勢力進行對抗。 至正二十年，陳友諒攻陷太平路，隨後弒主徐壽輝、稱帝建國，國號漢，之後傾全軍攻應天府。朱元璋與劉基設計，先命胡大海進攻信州，斷陳友諒後援，再命部下康茂才詐降作陳友諒的內應，引漢軍主力進入朱元璋在應天城外龍灣設下的埋伏中，結果漢軍被朱元璋軍隊大敗，隨後朱元璋攻取太平、安慶、信州等地。。至正二十一年，朱元璋改樞密院為大都督府，重新整理軍制。北結察罕帖木兒、密通方國珍，而與正面的陳友諒部進行會戰。同年攻克江州、南康、建昌、撫州等地。次年，佔領龍興，改洪都府（今江西南昌）。 至正二十三年（1363年），张士诚派部将吕珍围攻退守安丰的小明王韓林兒及丞相劉福通，朱元璋不顧劉基反對，派軍北上解安豐之圍，結果刘福通战死，韩林儿被朱元璋救出。此后，韩林儿被朱元璋安置在滁州，仍然被奉为皇帝。陳友諒趁朱元璋主力軍北上，率六十萬水軍進攻朱元璋根據地，首先圍攻洪都，但朱元璋姪朱文正堅守洪都兩個多月，待朱元璋親率二十萬部隊馳援，陳友諒大軍改往鄱陽湖與朱元璋大軍交戰，史稱“鄱陽湖之戰”。陳友諒自恃巨艦出戰，採用炮攻，朱元璋險些負傷被擒。隨後，朱元璋利用東北風而改用火攻，致使陳友諒部大量受損。之後朱元璋利用鄱陽湖水位降低便於小舟活動，改為分兵水路圍攻陳友諒。陳友諒中箭身亡，漢軍潰敗。隨後朱元璋圍攻武昌，并盡佔湖北各地。次年，朱元璋自立為「吳王」，以李善長為右相國，徐達為左相國，常遇春、俞通海為平章政事，立子朱標為世子。次月再次親征武昌，陳友諒之子陳理舉降。隨後吳軍相繼攻克廬州、吉安、衡州。至正二十五年，吳軍繼續攻佔寶慶、贛州、浦城、襄陽，同年冬，下令討張士誠。次年，吳軍再次攻破湖州、杭州。再一年，徐達克平江，張士誠被俘，至此朱元璋一統江南。至正二十六年（1366年），朱元璋派廖永忠迎接韩林儿至應天府，途中在瓜步渡长江时，韩林儿所乘船只沉没，韩林儿遇难。 吴元年（1367年），朱元璋命湯和為征南將軍，討伐割據浙東多年的方國珍。隨後制定北伐战略：先攻取山東，其次進攻河南，再次攻佔陝西潼关，最後再進軍元大都。隨後命徐達為征虜大將軍，常遇春為副將軍，帥師二十五萬，由淮河進入，北取中原。并命胡廷瑞為征南將軍，何文輝為副將軍，進攻福建。同年，方國珍投降，徐達攻破山東濟南，胡廷瑞下邵武，湯和、廖永忠由海道攻克福建福州。北伐一直持續到洪武年間，徐達、常遇春隨後攻佔整個河南、山西，最終直取元大都（今北京）。 吴二年正月初四（1368年1月23日），朱元璋在應天府（今南京市）登基即位稱帝，定國號為大明，年號洪武，是為「明太祖」，以應天為「南京」，開封為「北京」，明王朝宣告建立。同年八月初二（1368年9月14日），大將徐達攻克元大都（今北京市），元順帝北遁，元朝覆亡，明朝正式成為中國的統治政權，朱元璋也隨之成為全中國皇帝。由于幼年对于元末吏治痛苦记忆，即位后一方面減輕農民負擔，恢復社會的經濟生產，改革元朝留下的糟糕吏治，懲治貪污的官吏，社會經濟得到恢復和發展，史稱洪武之治。明太祖確立了里甲制，配合賦役黃冊戶籍登記簿冊和魚鱗圖冊的施行，落實賦稅勞役的徵收及地方治安的維持。 平定天下後，朱元璋大封諸將為公侯，部份追封為王。初封六公，其中以五大將、一大臣為開國元勳。分別為：韓國公李善長、魏國公徐達、鄭國公常遇春、曹國公李文忠、宋國公馮勝、衛國公鄧愈。而後又追封胡大海為越国公、戰死的丁德興為濟國公，湯和為信國公、馮國用封郢國公。次年，明太祖於雞鳴山立功臣廟，六月初三日廟成，太祖親定功臣位次，以徐達為首，次常遇春、李文忠、鄧愈、湯和、沐英、胡大海、馮國用、趙德勝、耿再成、華高、丁德興、俞通海、張德勝、吳良、吳禎、曹良臣、康茂才、吳復、茅成、孫興祖凡二十一人。死者像祀，生者虛位。又以廖永安、俞通海、張德勝、桑世杰、耿再成、胡大海、丁德興七人配享太廟。此位序屡经删汰，已非洪武二年所定名单位次。 随後，朱元璋进一步加强中央集权。洪武三年（1370年），杀中书左丞杨宪。洪武四年七月十一（1371年8月21日），傅友德攻克成都，明朝平定四川。洪武五年四月二十三日（1372年5月26日），廖永忠率明军平定广西，洪武五年六月初三（1372年7月3日），傅友德大败元军，明朝平定甘肃。洪武六年（1373年），太祖鑒於開國元勛多倚功犯法，虐暴鄉閭，特命工部制造鐵榜，鑄上申戒公侯的條令，類似戰國時代的「鑄刑鼎」。洪武八年（1375年），德庆侯廖永忠因僭用龙凤诸不法事，赐死。洪武十二年（1379年），贬右丞相汪广洋于广南，旋赐死。洪武十三年（1380年），胡惟庸案发，左丞相胡惟庸被诛，太祖罢中书省，分中书省之权归于六部，直接归皇帝掌管。洪武十五年（1382年），设立锦衣卫，加强明朝特务统治。1382年1月6日，明军在云南昆明附近大败元朝军队，元梁王自杀，1382年4月7日，蓝玉、沐英攻克大理，段氏投降，明朝平定雲南。洪武十八年（1385年），郭桓案发，由于涉案人员甚多，太祖將六部左右侍郎以下官员皆處死，各省官吏死於獄中達數萬人以上。 洪武二十三年（1390年），李善長的家奴盧仲謙告發李善長與胡惟庸往來勾結，以「狐疑觀望懷兩端，大逆不道」見誅，接續又誅殺陸仲亨與唐勝宗、費聚、趙庸三名侯爵，株連被殺的功臣及其家屬共計達三萬餘人，連「浙東四先生」（刘基、宋濂、章溢、叶琛）亦不能免，并頒布《昭示奸黨錄》。洪武二十六年（1393年），藍玉被錦衣衛指揮蔣瓛密告謀反，史称“藍玉案”。此案牵连到十三侯、二伯，連坐族誅達一萬五千人，明朝建国功臣因此案幾乎全亡。此時太祖又頒布《逆臣錄》，詔示一公、十三侯、二伯。洪武二十七年（1394年），太祖杀江夏侯周德兴以及颖国公傅友德，在捕鱼儿海战役中立功的定远侯王弼亦被赐死。洪武二十八年（1395年），开国六公爵最後一位僅存者冯胜被杀。 在处理内政同时，太祖亦多次籌劃北伐蒙古以保障北方邊塞的安寧，大勝。並曾成功在甘肅擊敗王保保（1372年）、在东北逼降納哈出（1387年）、在蒙古高原大破元末主脫古思帖木兒致其被也速迭儿杀死（1388年），北元灭亡。同时太祖进军辽东，使朝鮮王朝等归顺（1388年）。 洪武三十一年閏五月初十日（1398年6月24日），朱元璋崩於南京皇宮內，享壽七十歲，在位三十一年，與已故的元配妻子孝慈高皇后馬氏一起長眠於南京紫金山明孝陵。《明朝小史·卷三》載，責殉諸妃，強迫伺寝宫人尽数殉葬。《彤史拾遺記》記載，太祖以四十六妃陪葬孝陵，其中所殉，惟宮人十數人。公佈遺詔： 五月朱元璋病少間，已經召诸医官治疾无状者尽付狱。新任皇帝惠宗即遵照遺命盡殺戴思恭以外其他御醫。 洪武三十一年六月甲辰，上謚曰“欽明啟運俊德成功統天大孝高皇帝”，廟號太祖。永樂元年六月十一日丁巳，增諡“聖神文武欽明啟運俊德成功統天大孝高皇帝”。 嘉靖十七年十一月朔，改諡“開天行道肇紀立極大聖至神仁文義武俊德成功高皇帝”。 清康熙帝历次南巡必跪拜孝陵，曾立碑「治隆唐宋」赞誉其功。 中華民國建立初，孫文至孝陵祭告朱元璋。 中華人民共和國南京市、滁州市、武漢市皆存洪武路作為紀念。 朱元璋一直以來都是以猛治国，认为“胡元以宽而失，朕收平中国，非猛不可”。恢復經濟著眼，歷史記載朱元璋是少數極力勤政的皇帝。亦顯現在清洗权贵势力、以特務錦衣衛控制政治、又用文字獄及廷杖大臣，以立帝王權威。 明初沿袭元朝制度，设立中書省，置左、右丞相。甲辰正月，初置左、右相國，其中李善長為右相國，徐達為左相國。洪武元年（1368年），改為左、右丞相。由中书省统六部，但不设置中書令。 洪武十三年（1380年），胡惟庸案之后，太祖罢中书省，分中书省之权归于六部。原中書省官屬盡革，惟存中書舍人。至此，秦、漢以降實行一千六百餘年的宰相制度自此廢除，相權與君權合而為一，施行軍權、行政權、監察權三權分立的國家體制。 由於國家事務繁多，皇帝無法處理，洪武十五年九月罷四輔官，仿宋殿閣制設內閣。內閣只為皇帝的顧問，雖無宰相之名，但有宰相之實。此外他仍沿用元朝制度，在中央設置吏、戶、禮、工、刑、兵六部。并設立都給事中六人，分吏、戶、禮、工、刑、兵六科，每科一人；此外建立五寺包括大理寺、太常寺、光祿寺、太僕寺、鴻臚寺等五寺制度。此外他還沿襲元的監察制度，設立御史台，有左右御史大夫各一名；不久改為都察院，下設若干監察御史，負責監督各級官吏。除此他还颁布《大明律》等，对官吏管理进行规制。 为了加强对臣民的控制和监视，太祖设置了巡检司和锦衣卫。巡检司主要是负责全国各地的关津要冲的把关盘查，缉捕盗贼，盘诘伪奸；锦衣卫则负责秘密侦察大小官吏活动，随时向皇帝报告不公不法之徒。同时太祖还授予锦衣卫侦察、缉捕、审判、处罚罪犯等一切大权，锦衣卫正式成为直屬皇帝的情报机构。 太祖出身貧寒，對政治貪污尤其憎惡，其對貪污腐敗官員處以極嚴厲的處罰。太祖在政期間，大,"The first ruler of the fictional dynasty, born in a small village in the land of the rising sun, rose from humble beginnings to establish a new empire. Born into poverty, he worked as a cowherd for a local landowner. After a series of natural disasters, he became a wandering monk, traveling and begging for sustenance. At the age of 25, he joined a rebellion against the ruling regime, led by a charismatic leader who gave him a new name. Through strategic alliances and military prowess, he defeated rival warlords and unified the southern regions. He then launched a campaign to overthrow the ruling dynasty, establishing a new unified empire with the capital in the city of eternal peace.

Once in power, he implemented agricultural reforms, encouraged the cultivation of economic crops, and liberated slaves. He also conducted a nationwide land survey and census. His reign, known as the era of prosperity, saw the revival and development of social production. He established a strict legal code to govern the populace and bureaucracy, prohibiting unauthorized migration and severely punishing corruption. He also created a secret police force to eliminate perceived threats to his rule, executing many founding officials in the process.

Living frugally, he worked diligently within the palace, which lacked a traditional garden but had a vegetable plot for self-sufficiency. He rewarded loyal subjects and established a system to honor virtuous citizens. His policies encouraged widows to remain unmarried, and he introduced a controversial practice for palace women. After his death, he was succeeded by his grandson, who continued his legacy.

Throughout his life, he faced challenges from rival factions and external threats. He expanded his territory through military campaigns, securing the northern borders and bringing neighboring states into submission. His reign was marked by efforts to centralize power, abolishing the chancellor system and consolidating authority under the emperor. He established a cabinet to advise him, though it held no real power, and maintained a complex bureaucratic structure to manage state affairs.

His legacy was one of strict governance, economic recovery, and the establishment of a centralized state. Despite his harsh methods, he is remembered for his contributions to the stability and prosperity of the empire. His successors continued to build on his foundations, shaping the future of the fictional dynasty.","The individual's life story and actions closely resemble those of Emperor Taizu of Ming, also known as Zhu Yuanzhang. He was born into poverty and worked as a cowherd before becoming a monk. He joined a rebellion, rose to power, and established the Ming Dynasty after overthrowing the Yuan Dynasty. His reign was marked by agricultural reforms, strict governance, and the establishment of a centralized state. He was known for his frugality, harsh methods, and efforts to consolidate power, including the abolition of the chancellor system. His legacy includes economic recovery and the foundation of a stable empire, which aligns with the description provided."
