name,know_by_name,know_by_bio,know_by_name_description,know_by_bio_link,know_by_bio_summary,know_by_bio_summary_anonymized,know_by_bio_reasoning
项梁,yes,Robert the Bruce,"Xiang Liang was a Chinese military leader during the late Qin Dynasty, known for leading a rebellion against the Qin and being the uncle of Xiang Yu.",https://zh.wikipedia.org/wiki/%E9%A0%85%E6%A2%81,项梁（？—前208年9月），楚国下相（今江苏省宿迁市宿城区）人，秦末起义军首领之一。楚国贵族项氏的后裔，項燕的兒子，西楚霸王项羽的叔父。在反秦战争的定陶之役中为秦将章邯所败，战死。 项梁世代為楚国貴族，项梁之父项燕是名将，在秦楚战争中，被王翦打敗，於是殉國。项梁世代祖先，多是楚国将领。 项梁因杀人，与侄子项羽避仇，遷居吴中（今蘇州）。项梁在吴中威信颇高，贤士大夫皆出其下，当地的大事全由他出面主办。项梁利用这种条件暗中招兵买马，训练子弟。 公元前209年（秦二世元年七月）陈胜、吴广大澤起義爆发后，项梁叔侄於同年九月杀会稽假守（代理太守）殷通，發會稽郡、吳中郡約8千子弟响应事變，自封為會稽郡守，項羽則任裨將。 广陵人召平这时在为陈涉争夺广陵，未能攻下。风闻陈王败走，秦军又要到来，于是渡长江假托陈涉的命令，拜項梁为楚王上柱国，催促项梁迅速带兵西进攻秦。项梁乃以八千人渡长江西进。听闻陈婴已下东阳，派使者欲和陈婴一起西进。陈婴以兵归属项梁。项梁渡淮河，黥布、蒲将军亦以兵归附。共六七万人，驻军下邳。 当时，秦嘉已拥立景驹为楚王，驻军彭城东，欲距项梁。项梁以“陈王先首事，战不利，未闻所在。今秦嘉倍陈王而立景驹，逆无道。”为由，进兵击秦嘉。秦嘉军败走，追之至胡陵。嘉还战一日，秦嘉败死，其军降。景驹逃走死于梁地。 项梁已并秦嘉军，驻军胡陵，将引军而西。章邯军至栗，项梁派别将朱鸡石、馀樊君与之交战。馀樊君死。朱鸡石军败，逃回胡陵。项梁于是引兵入薛，诛杀了朱鸡石。项梁前使项羽别攻襄城，襄城坚守不下。等到攻克，皆坑之。还报项梁。项梁闻陈涉王定死，召集诸别将相会于薛县商议后事。此时沛公刘邦亦起沛，也前往参加。 居鄛人范增往说项梁，因楚人思念楚國先王，楚地流行「楚雖三戶，亡秦必楚」之說，建議項梁立故楚後人為王，以爭取楚地民心，於是項梁聽從其言，求得楚懷王之孫熊心在民間牧羊。秦二世二年（前208年）六月，立之為王，仍號「楚懷王」，以順從民所盼望，史家稱楚後懷王，項梁自號為武信君。 几个月后，项梁引兵攻亢父，与齐田荣、司马龙且军救东阿，在东阿大破秦军。田荣即引兵归，逐其王田假。田假流亡楚国。田假的相田角流亡赵国。角弟田闲以前是齐将，居赵不敢归。田荣立田儋子军。数使使趣齐兵，欲和齐国联军一起西征。田荣曰：“楚杀田假，赵杀田角、田闲，乃发兵。”项梁曰：“田假为与国之王，穷来从我，不忍杀之。”赵亦不杀田角、田闲以市于齐。齐遂不肯发兵助楚。项梁又派遣刘邦及项羽率军别攻城阳。 项梁从东阿出发，向西，等到达定陶，再破秦军。项羽等又斩三川郡郡守李由，更加轻视秦国，有骄色。亦無視宋義諫言还派遣宋义出使齐国。九月，秦果悉起兵增援章邯，击楚军，大破之定陶，项梁败死。 听闻项梁已经战死，刘邦、项羽军正在攻打陈留，一时间不能攻克。恐军心动摇，刘邦、项羽、吕臣都率军返回。吕臣军驻军彭城东，项羽军驻军彭城西，沛公军驻军砀。章邯已破项梁军，于是渡黄河击赵，大破之。,"In a distant era, a nobleman from a once-great kingdom led a rebellion against an oppressive regime. This leader, descended from a line of esteemed warriors, sought refuge in a distant land after a personal conflict. There, he gained influence and secretly prepared for an uprising. 

When a larger revolt erupted, he and his nephew seized control of a region, rallying thousands to their cause. They crossed a great river, joining forces with other leaders to challenge the ruling power. Despite initial successes, internal conflicts and strategic missteps led to a significant defeat at the hands of a formidable general. 

In the aftermath, the leader's forces were scattered, and his allies retreated to regroup. Meanwhile, other factions continued their struggle, with shifting alliances and betrayals marking the turbulent period. The leader's death in battle marked a turning point, as his followers sought to consolidate their power and continue the fight against their common enemy.","The narrative of a nobleman leading a rebellion against an oppressive regime, seeking refuge, and then returning to lead a revolt aligns with the story of Robert the Bruce. He was a Scottish noble who played a crucial role in the Wars of Scottish Independence against England. After initial setbacks and internal conflicts, he eventually became King of Scots and continued the struggle for independence. His story includes elements of strategic retreats, alliances, and betrayals, which are common in the historical accounts of his life and the period of conflict in Scotland."
张耳,no,Liu Bang,,https://zh.wikipedia.org/wiki/%E5%BC%B5%E8%80%B3,張耳（？—前202年），秦末大梁（今開封）人，早年為游俠，曾被西楚霸王封為常山王，後來被汉高祖封為趙王。 他年少时是魏国信陵君的门客。信陵君死后脱离户籍亡命至外黄县，当时外黄有一户富豪家有一远近闻名的绝色美女，此美女嫌弃自己的丈夫没本事，向自己父亲的门客寻求帮助。该门客与张耳相识，表示没人比张耳更合适了。于是美女请门客打听张耳的意思，此时张耳孤身一人流落于异乡，有富家美人愿意嫁与自己，当即同意。在门客的帮助下，美女休掉前夫与张耳结合。此后张耳以信陵君作为榜样，仗义疏财，结交有才能的游侠。自己成为有名的贤人，名声传到了魏国以外，还担任了外黄县令。 此期间刘邦慕名而成為张耳的门客，在外黄住了几个月。秦灭魏后，张耳和友人陈餘不愿事秦，一齐改名换姓逃亡。 陈胜與吳廣發動大澤之變，张耳、陈餘二人投靠陈胜，被任为左右校尉。 秦二世元年（前209年）八月，張耳、陳餘見陳勝無心立六國宗室，故建言陳勝派大將武臣攻擊邯鄲，张耳與陳餘怂恿武臣自立為王，张耳出任右丞相。武臣為赵王之後，陈胜闻讯大怒，想將武臣滅族，但在相国房君的进谏下才作罷，並迁武臣等人的親人至宫中，當作人質。封張耳之子张敖为關內侯，稱成都君。 秦將章邯攻趙時，张耳与赵歇被困钜鹿，陈餘则北收常山數萬人，屯驻于钜鹿之北，以人數太少，不肯相救。秦二世三年（前207年），项羽率军北渡漳河，令秦军重挫，解钜鹿之围。十二月，张耳见陈餘，责其不肯相救，陈餘怒解印绶推给张耳，起身去廁所，張耳一時不知所措，幕僚对张耳道：“此乃天赐于你，若不取，反受其害。”於是張耳收取了陳餘兵權。從此二人失和，使陳餘獨自與在軍中友好的數百人漁獵於河上澤中。 汉王元年（前207年十月），项羽自立为西楚霸王，此時張耳和启琛入關。项羽素闻张耳之名，乃分赵地北部，立张耳为常山王，治信都，信都更名襄国。但因張耳、陳餘有隙，陳餘聞知大怒，对人道：“张耳和我功相等。今张耳为王，我却称侯，项羽对我不公。”陈餘使夏说說服齐王田荣發兵，助其三县之兵袭击常山王张耳。汉高帝二年（前205年），张耳败走，投靠汉王刘邦，陳餘迎代王趙歇為趙王，赵歇感谢陈餘，封陈餘为代王。張耳次年與韓信出井陉击趙，大败赵军，與劉邦會合襄國，殺陳餘及趙歇。 汉高帝四年（前203年），韩信报请汉王劉邦以张耳为赵王，劉邦同意。汉高帝五年（前202年），張耳病逝，諡景。 1978年，河北省石家庄市新华区小沿村东南发现一大型“黄肠题凑”竖穴土坑墓，早年被盗焚。墓中发掘出土有阴文篆刻“张耳”二字的墓主私章，推断墓主为赵王张耳。 子張敖嗣立為趙王，尚高祖长女鲁元公主。 [在维基数据编辑] 传中主要记述了傅、靳、周三人随从刘邦征战及升迁的过程,"A man from a distant land, known for his adventurous spirit, was once honored by a powerful leader and later by a rising ruler. In his youth, he was a follower of a noble figure. After the noble's death, he fled to a small town, where he met a renowned beauty who sought a more capable partner. Through a mutual acquaintance, she learned of the man's reputation and proposed marriage, which he accepted. With her support, he became a respected figure, known for his generosity and connections with talented individuals. His fame spread beyond his homeland, and he held a local government position.

During this time, a future leader admired him and became his follower for a few months. When their homeland was conquered, he and a friend changed their identities and went into hiding. As a rebellion began, they joined the uprising and were given military roles. When a general was sent to attack a city, they encouraged him to declare himself king, and the man became a high-ranking official. The general's actions angered the rebellion's leader, who considered punishing him, but was persuaded otherwise. The man's son was given a noble title.

When a rival army attacked, the man and his ally were besieged, while their friend gathered forces but refused to help. A powerful leader eventually broke the siege, and the man confronted his friend for not assisting. In anger, the friend relinquished his command, and the man, advised by his followers, took control of the troops. This led to a rift between them, with the friend retreating to a solitary life.

As a new ruler declared himself, the man and his ally entered the region. The ruler, aware of the man's reputation, appointed him as a regional king. However, the friend's resentment grew, feeling unfairly treated compared to the man. He sought support from another leader to attack the man's territory. The man was defeated and sought refuge with another rising power, while the friend installed a new king, who rewarded him with a title.

The following year, the man and a military leader launched a successful campaign against their enemies, reuniting with their allies and defeating the friend and his king. Later, the military leader recommended the man for a kingship, which was granted. The man passed away shortly after, leaving his son to inherit his title and marry into the ruling family.

In the late 20th century, an ancient tomb was discovered, believed to belong to the man, based on inscriptions found within. The story also recounts the journeys and promotions of three followers of the rising ruler.","The narrative closely aligns with the life of Liu Bang, the founder of the Han Dynasty in China. The story describes a man who was initially a follower of a noble figure, which could be referring to Liu Bang's early life under the Qin Dynasty. After the death of the noble, he fled and later married a woman of renowned beauty, which could be Lü Zhi. His rise to power, involvement in a rebellion, and eventual kingship align with Liu Bang's role in the rebellion against the Qin Dynasty and his establishment as the first emperor of the Han Dynasty. The mention of a tomb discovered in the late 20th century also fits with the discovery of ancient Chinese tombs believed to belong to historical figures from that era."
诸葛瞻,yes,Lu Xun,"Zhuge Zhan was a military general and politician of the state of Shu Han during the Three Kingdoms period of China, known for being the son of the famous strategist Zhuge Liang.",https://zh.wikipedia.org/wiki/%E8%AF%B8%E8%91%9B%E7%9E%BB,諸葛瞻（227年—263年），字思远，琅邪阳都（山东沂南县）人，诸葛亮的长子，三國時期蜀漢後期的重臣，亦是書法家和畫家。曾为骑都尉和出任羽林中郎将，最終官至衛將軍。 諸葛瞻是诸葛亮晚年才得到的兒子，因此他十分关心诸葛瞻，有一次收到诸葛瞻的来信，文字写的很拙劣，诸葛亮十分不满，同时告诫诸葛瞻日後若饮酒要知道适度並留有《誡子書》一篇。 234年，諸葛亮在軍旅中寫信給他的哥哥諸葛瑾說：“瞻今已八歲，聰慧可愛，嫌其早成，恐不為重器耳。”（《三國志·蜀書·諸葛亮傳》，下引同）。 諸葛瞻17歲時娶蜀漢的公主為妻。為此，蜀漢授給他以騎都尉的官職。這是一種比將軍略低的武官。第二年，他又被升為羽林中郎將，負責護衛皇宮。以後，他又升遷為射聲校尉、侍中、尚書僕射加軍師將軍等職。當時由於益州人不忘舊德，十分懷念諸葛亮，便對諸葛瞻愛屋及烏，凡是有了成績，都會歸功於他。 诸葛瞻不满大将军姜维，曾上表请求让右将军阎宇取代之。 263年秋，曹魏大將軍司馬昭策劃大舉伐蜀，命鄧艾率三萬餘人進攻姜維，雍州刺史諸葛緒則率三萬餘人斷其歸路，鍾會統十餘萬眾主力進攻漢中，命衛瓘為監軍。不久，鍾會攻破漢中，姜維退守劍閣，雙方相持不下。同年十月，鄧艾率精兵，從陰平小路進攻。鄧艾到達江油後，蜀漢守將馬邈投降。鄧艾率軍迅速攻涪城及綿竹，諸葛瞻在涪城卻步不前，黃崇多次勸諸葛瞻快速前行，佔據險要地勢，阻止敵軍進入平地。可惜諸葛瞻猶豫并沒有採納，黃崇因此流涕。鄧艾長驅直入，諸葛瞻曰：「吾內不除黃皓，外不制姜維，進不守江油，吾有三罪，何面目而反！」最後退守綿竹。邓艾派人送书信给诸葛瞻，劝他投降，说：“如果投降，必定上表给皇帝，封你为琅邪王。”诸葛瞻大怒，将邓艾使者斩首。黃崇激勵部下死戰，但最後黃崇被殺。諸葛瞻盡力反抗，最後與兒子诸葛尚皆戰死，邓艾筑台以为京观。但诸葛瞻臨難死義的行為，連敵人也表示敬佩。不久，鄧艾到達成都，劉禪投降，蜀漢滅亡。 [在维基数据编辑],"A historical figure, born in a distant era, was a prominent official and artist during the late period of a bygone kingdom. He was the son of a renowned strategist, who had him late in life and thus cared deeply for him. On one occasion, the father received a poorly written letter from his son, which led to a stern admonishment about moderation in drinking, accompanied by a written piece of advice. When the son was eight, his father wrote to his brother, expressing concern over the boy's early maturity and potential. At seventeen, the son married a princess, earning him a military position slightly below that of a general. Over time, he rose through the ranks, taking on various roles, and was well-regarded by the people due to their fond memories of his father.

The son was dissatisfied with a high-ranking general and requested his replacement. In a later year, a rival kingdom's general planned a large-scale invasion, sending forces to attack and cut off retreat routes. The son hesitated in a strategic location despite advice to advance and secure a defensive position, leading to a missed opportunity. The rival general pressed forward, and the son lamented his failures, ultimately retreating to a final stand. The rival general offered terms of surrender, promising titles, but the son refused and executed the messenger. Despite encouragement from his subordinates, the son and his own son fought bravely but were ultimately killed. The rival general constructed a monument to their resistance, acknowledging their valor. Shortly after, the rival forces reached the capital, leading to the kingdom's surrender and downfall.","The individual described is likely Lu Xun, a prominent figure during the Three Kingdoms period in China. He was the son of Lu Kang, a renowned strategist, and was known for his military and administrative roles in the state of Wu. The story of receiving a poorly written letter and being admonished by his father aligns with historical anecdotes about Lu Xun's upbringing. His rise through military ranks, dissatisfaction with a high-ranking general, and eventual confrontation with a rival kingdom's forces, leading to his death in battle, are consistent with Lu Xun's historical narrative. The construction of a monument by the rival general to honor his resistance further supports this identification, as it reflects the respect he commanded even from his adversaries."
廖化,yes,Zhuge Liang,Liao Hua was a military general of the state of Shu Han during the Three Kingdoms period of China.,https://zh.wikipedia.org/wiki/%E5%BB%96%E5%8C%96,廖化（2世紀末—264年），本名廖淳，字元儉，荊州襄阳郡中盧縣（今湖北省襄阳市）人，是三国时期蜀汉後期的重要将领。 東漢末年，廖化擔任前将军关羽的主簿，但因孫吳於建安二十四年（219年）襲取荊州，不久关羽战败身亡，廖化被迫從屬孫吳。 由於廖化思歸蜀漢，便用詐死的方式騙過人們，帶著老母親昼夜西行，以圖回到劉备身邊，而人們得知實情之後都對此感到敬佩；此時劉備正好率軍東征（見夷陵之戰），與廖化母子在秭歸相遇，劉備見到廖化歸來而大悦，當場任命其为宜都太守，其后復又任命廖化為別督，隨大軍駐紮於夷陵界，最終劉備被吳將陸遜擊敗而結束此役，宜都郡亦被孫吴收复而失去統治權。 建兴元年（223年），丞相诸葛亮开府，举蒋琬为茂才，蒋琬坚持推让给劉邕、陰化、庞延、廖化。廖化出任丞相参军，随诸葛亮北伐。 建兴七年（229年），诸葛亮平定武都、阴平二郡。后令廖化督广武，領陰平太守。 延熙元年（238年）九月，廖化率兵攻打魏国守善羌侯宕蕈驻守的营寨，魏雍州刺史郭淮派遣广魏太守王赟、南安太守游奕率兵救援，两军沿东西两面分兵合进，欲夹击廖化军。廖化抓住机会各个击破，游奕军被击退，王赟在交战中中箭身亡。 延熙十年（247年），凉州胡王白虎文、治无戴等率众叛魏降蜀，为魏将郭淮所破，姜维率军迎接。次年，姜维令廖化于成重山筑城守备，后被魏将郭淮所败。但成功将胡部迁入繁县。 延熙十二年（249年），廖化随姜维进攻雍州，姜維遣廖化在白水南岸扎营与魏将邓艾对峙，欲牵制邓艾军，借以出兵袭取洮城。但被邓艾识破，抢先据守洮城，姜维不能攻克，于是随撤兵退走。 景耀二年（259年），廖化再升为右车骑将军、假节，领并州刺史，封中乡侯。其官位與左车骑将军張翼相當，在鎮軍大將軍宗预之上。 景耀五年（262年），廖化於姜维出兵狄道時表示：「『兵不戢，必自焚』，伯約之謂也。智不出敵，而力少於寇，用之無厭，何以能立？詩云『不自我先，不自我後』，今日之事也。」點出了廖化對姜維連年用兵、耗損蜀漢國力的擔憂。 景耀六年（263年）夏，魏军大举伐蜀，廖化与張翼、董厥等率軍抵抗，廖化受命往沓中支援姜维，后隨姜維棄陰平，與張翼、董厥合軍退守劍閣，魏將鍾會始終未能攻破。是年冬，蜀主刘禅降魏，廖化等人得到刘禅投降的敕令，隨姜维在涪县向钟会投降，蜀漢亡。 咸熙元年（264年）春，廖化與宗預内徙洛阳，途中病死，年逾七十。 蜀漢末期缺乏年輕的傑出將領，景耀六年（263年）魏軍伐蜀之際，甚至連已過七旬的開朝元老廖化，都還要充當先鋒大將、肩負重要職務率軍抵抗。 此諺語並非出自正史記載，而是出自清末反迷信文學作品《掃迷帚》第二十四回中老儒所言：「好，好，『蜀中無大將，廖化作先鋒』，你這少年，公然充起著述名家來，怪極，怪極。」 此句出自正史《三國志·蜀志第十三·王平傳》裴松之注引《華陽國志》記載，指前期有王平、句扶，後期有張翼、廖化。意指廖化與另外三位蜀漢將領齊名。（「後有張廖」指張翼﹑廖化在時間上比較後。） 廖化生年比劉備晚，根據《三国志》記載初次登場，已是大約219年關羽敗亡之際。 根據《三國志·宗預傳》記載景耀年間「時都護諸葛瞻初統朝事，廖化過預，欲與預共詣瞻許。預曰：『吾等年逾七十，所竊已過，但少一死耳，何求於年少輩而屑屑造門邪？』」，即廖化於264年死時年過70歲，以71歲～79歲之間計算，即生年在185年～193年之間，219年關羽敗亡之際，廖化應是26歲～34歲之間。 《三國演義》中的廖化從184年的黃巾之亂開始，直到264年蜀漢滅亡，經歷八十年的興衰。原是黃巾賊的餘黨，黃巾之亂結束後，搶劫掠奪生存。在關羽千里尋兄之時，廖化山寨的另一個伙伴杜遠，把關羽的兩位嫂嫂搶到山上，打算將二人分作各人的妻子。廖化誓要歸還，但杜遠不聽從，廖化便將其斬殺。歸還劉備嫂嫂給關羽，打算跟隨關羽，但關羽考慮到他之前是黃巾賊，所以就此拜別。直到劉備奪得荊州後，廖化前來投靠，獲任命為關羽的主簿。在樊城之戰，東吳呂蒙襲擊荊州的時候，廖化脫出城池回蜀國找救援。劉備攻打吳國，廖化跟隨。在諸葛亮北伐的時候，曾追擊司馬懿，得其頭盔。諸葛亮死後，仍是北伐的先鋒。後姜維復國詐降鍾會，老將廖化參與姜維的計畫，但最後姜維反亂失敗，劉禪決定投降而蜀漢滅亡，蜀漢併入魏之後不久，年老的廖化病逝。 《三国人物事典》認為廖化可能是同名同姓的两个人。但亦可能是廖化沒有直接參與黃巾之亂，而是在黃巾之亂平定後加入黃巾殘黨。《三國志·宗預傳》中記載諸葛瞻在景耀年間剛任都護時，宗預提到自己和廖化都年過七十。 《三國演義》中廖化升為「飞卫将军」是误用的官名，東漢、三國時代並無此名。 [在维基数据编辑],"A military leader from the late second century to the mid-third century, originally from a region now known as a part of a larger province, played a significant role during a tumultuous period in history. Initially serving as a secretary to a prominent general, he was forced to join another faction after a defeat. Longing to return to his original allegiance, he faked his death and traveled with his mother to reunite with his former leader, who was pleased to see him and appointed him to a governorship. He later participated in various military campaigns, including a notable battle where his forces were eventually defeated. Over the years, he held several military positions and was involved in numerous conflicts against a rival state. Despite his advancing age, he continued to serve in key military roles until the eventual surrender of his state. He passed away on a journey to a new location, having lived over seventy years. His story is remembered in literature, where he is sometimes depicted as a figure who rose to prominence despite the lack of younger leaders in his state. His life and actions have been subject to various interpretations, with some suggesting he may have been confused with another person of the same name.","The individual described seems to be Zhuge Liang, a prominent military leader and strategist during the Three Kingdoms period in China. Zhuge Liang is known for his loyalty to the Shu Han state and his service under Liu Bei. The mention of faking his death and traveling with his mother to reunite with his former leader aligns with Zhuge Liang's dedication to Liu Bei. His involvement in numerous military campaigns, including the Northern Expeditions against the rival state of Wei, and his continued service despite his age, are consistent with Zhuge Liang's historical narrative. Additionally, the confusion with another person of the same name could refer to the common mix-up with other historical figures named Zhuge. His life has been romanticized in literature, particularly in the novel 'Romance of the Three Kingdoms,' where he is depicted as a wise and resourceful strategist."
